{
  "kind": "routing_oracle",
  "schema_version": "1.0.0",
  "case_id": "case-0003",
  "oracle_version": "1.0.0",
  "expected_verdict": "BLOCKED",
  "mandatory_reason_codes": [
    "aggregation_threshold_not_met"
  ],
  "acceptable_next_actions": [
    "Coarsen dimensions or widen the population"
  ],
  "critical": true,
  "defect_pattern": "aggregate_threshold_failed",
  "authored_by": {
    "actor_id": "user_steward_01",
    "actor_type": "human",
    "role": "data_steward"
  }
}
