{
  "kind": "routing_oracle",
  "schema_version": "1.0.0",
  "case_id": "case-0005",
  "oracle_version": "1.0.0",
  "expected_verdict": "PROVISIONAL",
  "mandatory_reason_codes": [
    "unsupported_outcome_probability"
  ],
  "acceptable_next_actions": [
    "Supply qualified labels"
  ],
  "critical": true,
  "defect_pattern": "missing_labels",
  "authored_by": {
    "actor_id": "user_steward_01",
    "actor_type": "human",
    "role": "data_steward"
  }
}
