{
  "kind": "routing_oracle",
  "schema_version": "1.0.0",
  "case_id": "case-0001",
  "oracle_version": "1.0.0",
  "expected_verdict": "BLOCKED",
  "mandatory_reason_codes": [
    "forbidden_row_level_egress"
  ],
  "acceptable_next_actions": [
    "Request an aggregate output task"
  ],
  "critical": true,
  "defect_pattern": "forbidden_row_egress",
  "authored_by": {
    "actor_id": "user_steward_01",
    "actor_type": "human",
    "role": "data_steward"
  }
}
