{
  "kind": "routing_oracle",
  "schema_version": "1.0.0",
  "case_id": "case-0009",
  "oracle_version": "1.0.0",
  "expected_verdict": "BLOCKED",
  "mandatory_reason_codes": [
    "promotion_criteria_failed"
  ],
  "acceptable_next_actions": [
    "Remediate the provider artifact and re-evaluate"
  ],
  "critical": true,
  "defect_pattern": "provider_artifact",
  "authored_by": {
    "actor_id": "user_steward_01",
    "actor_type": "human",
    "role": "data_steward"
  }
}
