{
  "kind": "routing_oracle",
  "schema_version": "1.0.0",
  "case_id": "case-0012",
  "oracle_version": "1.0.0",
  "expected_verdict": "BLOCKED",
  "mandatory_reason_codes": [
    "grain_incompatible"
  ],
  "acceptable_next_actions": [
    "Choose a compatible modeling unit"
  ],
  "critical": false,
  "defect_pattern": "mixed_grains_unrelatable",
  "authored_by": {
    "actor_id": "user_steward_01",
    "actor_type": "human",
    "role": "data_steward"
  }
}
