{
  "kind": "routing_oracle",
  "schema_version": "1.0.0",
  "case_id": "case-0004",
  "oracle_version": "1.0.0",
  "expected_verdict": "PROVISIONAL",
  "mandatory_reason_codes": [
    "missing_execution_policy"
  ],
  "acceptable_next_actions": [
    "Obtain an execution policy for the location"
  ],
  "critical": false,
  "defect_pattern": "missing_execution_policy",
  "authored_by": {
    "actor_id": "user_steward_01",
    "actor_type": "human",
    "role": "data_steward"
  }
}
