{
  "kind": "routing_oracle",
  "schema_version": "1.0.0",
  "case_id": "case-0011",
  "oracle_version": "1.0.0",
  "expected_verdict": "PROVISIONAL",
  "mandatory_reason_codes": [
    "unregistered_source_profile"
  ],
  "acceptable_next_actions": [
    "Complete steward confirmation"
  ],
  "critical": false,
  "defect_pattern": "unconfirmed_source",
  "authored_by": {
    "actor_id": "user_steward_01",
    "actor_type": "human",
    "role": "data_steward"
  }
}
